job_title,match_title
residential counselor,Residential Substance Abuse Counselor
"On-Demand: Guest Advocate (Cashier), General Merchandise, Fulfillment, Food and Beverage, Style (T0692)",Guest Advocate
Housing Compliance Manager,Housing Manager
Guest Advocate (Cashier or Front of Store Attendant/Cart Attendant) (T0770),Guest Advocate
Sr. UX/ UI Designer,Software Quality Assurance Analysts and Testers - User Interface and User Experience Designer (UI/UX Designer)
Mechanical Engineer Intern (Summer 2024),Mechanical Engineer
Speech Language Pathologist Assistant-PRN,Language Pathologist
FRA Assessor,Assessor
Nurse Practitioner- Allergy,Nurse Practitioner (NP)
Assistant Grocery Manager - Woolworths Newman (Relocation Package),Grocery Manager
"Personal Financial Counselor, Assignment Ready Counselor, PFC, Oklahoma",Personal Counselor
"Mako Associate Account Executive - Louisiana, Arkansas, Mississippi, Alabama, FL Panhandle",Account Executive
SAFETY & PHARMACOVIGILENCE SPECIALIST,Safety Specialist
"In-Person Fully-Licensed Therapist (LCSW, LMFT, LPC)",Licensed Therapist
Motorclothes Retail Sales Associate,Retail Associate
"On-Demand: Guest Advocate (Cashier), General Merchandise, Fulfillment, Food and Beverage, Style (T0343)",Guest Advocate
Guest Advocate (Cashier or Front of Store Attendant/Cart Attendant) (T1766),Guest Advocate
Cost Consultant,Cost Consultant
"Guest Advocate (Cashier), General Merchandise, Inbound (Stocking) (T3369)",Guest Advocate
Medical Assistant (MA) - Family Medicine Residency,Family Medicine Medical Assistant
Principal Cyber Software Test Engineer (EC),Software Engineer
International GCSE Greek Principal Examiner,Examiner
"Senior Architectural Technician - Multi Sector in Newcastle upon Tyne, UK",Architectural Technician
Commercial Real Estate Asset Management - Construction Senior Manager,Construction Manager
Academic Advisor & Academic Advising Assistant (multiple positions),Academic Advisor
Account Executive - Level 2,Account Executive
Construction Manager with Security Clearance,Construction Manager
"Account Executive, Enterprise Canada",Account Executive
"Sr. Manager, Regulatory Affairs - Pharma",Regulatory Affairs Manager (RA Manager)
Clinical Nurse-Stem Cell Transplant Navigator,Nurse Navigator
Therapist (Child & Adolescent Day Hospital),Child and Adolescent Therapist
Construction Crew Foreman,First-Line Supervisors of Construction Trades and Extraction Workers - Crew Foreman
"On-Demand: Guest Advocate (Cashier), General Merchandise, Fulfillment, Food and Beverage, Style (T1316)",Guest Advocate
"CT Technologist - FLEX Contingent, NEW Competitive Rate",Technologist
Guest Advocate (Cashier or Front of Store Attendant/Cart Attendant) (T0840),Guest Advocate
MANUFACTURING ENGINEER III,Manufacturing Engineer
Assistant Professor (Project Management),Management Professor
Volunteer: Squadron Commander Needed -- Civil Air Patrol: United States Air Force Auxiliary,Patrol Commander
Adjunct Lead Instructor on Campus,Adjunct Art Instructor
Complex Human Resources Manager,Human Resources Manager (HR Manager)
Call Center Supervisor Opportunity for Global Travel Company,Supervisor
Beauty Advisor (Inside Sales) Sally Beauty 01559,Advisor
Database – Principal Advanced Support Engineer,Database Engineer
Civil Engineering Technologist/Project Engineer,Civil Engineer
Commercial Administrator,Administrator
Data Scientist – Fraud Specialist,Fraud Specialist
Culinary Supervisor - Serenity Rehab and Health - Food,Supervisor
Electrical Engineer - Project Leader,Project Leader
Assistant Project Manager - Senior Living Construction,Construction Manager
Civil Project Engineer III - Stormwater,Civil Engineer
Conference Services Manager - NEW Kimpton-Kimpton Denver Tech,Conference Manager
National Account Manager (Personal Care),National Account Manager
Senior Dotnet Developer,C Developer
Process Technology Advisor,Advisor
Guest Advocate (Cashier or Front of Store Attendant/Cart Attendant) (T0877),Guest Advocate
Senior Strategic Account Executive,Account Executive
Substitute - Cafeteria Worker,Substitute
Service Advisor (Holly),Advisor
Project Delivery Capability Manager,Delivery Manager
Customer Service Rep (Inside Sales),Inside Sales and Customer Service Representative (Inside Sales and Customer Service Rep)
Customer Service Representative (Motivator) - Ottawa Lansdowne Park,Customer Service Representative
Patient Access Specialist,Patient Representatives - Patient Access Specialist
National Key Account Manager - Pharmacy,National Account Manager
Guest Advocate (Cashier or Front of Store Attendant/Cart Attendant) (T1247),Guest Advocate
Growing CPA Firm in Frisco Is Seeking a Senior Accountant,Accountant
Service Advisor (Toowoomba location),Advisor
Regional Pricing Manager,Pricing Manager
"Sales Compensation and Operations Leader, Project Kuiper, BizOps",Project Leader
Guest Advocate (Cashier or Front of Store Attendant/Cart Attendant) (T1246),Guest Advocate
Commercial Lines Account Manager- Transportation,Commercial Lines Manager
Lifeguard ($17.23/hour - $23.25/hour),Lifeguard
Facility Solutions Manager - Account Manager,Facility Manager
"Diabetes Sales Specialist - Abbott Diabetes Care (Ottawa, ON - Field Based)",Field Specialist
Post Award Grant Accountant,Accountant
Guest Advocate (Cashier or Front of Store Attendant/Cart Attendant) (T1360),Guest Advocate
Immediate Hiring - Quality Control Chemist,Chemist
Sales Coach - Monitoring Car Rental Station Results,Coach
Master/Diagnostic Automotive Technician,Automotive Cooling System Diagnostic Technician (Auto Cooling System Diagnostic Tech)
Equipment Validation Engineer,Validation Engineers - Equipment Engineer
Construction Project Engineer    Recent Graduates Welcome,Construction Project Engineer
Lead Vascular Tech Ultrasound,Vascular Ultrasound Tech (Vascular Ultrasound Technician)
AR Collections Specialist( Temp to Hire),To Go Specialist
DEPUTY DIRECTOR,Deputy District Customs Director
Technical Writer / Interface Specialist (Business Staffing Support Services - L3) NGA - St Louis,Staffing Specialist
QA Automation Tester,Automation Tester
Nurse Practitioner (NP) or Physician Assistant (PA) FT/PT/PRN - All Shifts - Days or Weekends,Physician Assistant (PA)
Instructor I,Joint Terminal Attack Controller Instructor (JTAC-I)
Restaurant Manager - Melbourne,Restaurant Manager
Guest Advocate (Cashier or Front of Store Attendant/Cart Attendant) (T2204),Guest Advocate
AfterTreatment Development Engineer,Development Engineer
Tier 2 Desktop Service Analyst – Primarily Onsite,Desktop Analyst
Guest Advocate (Cashier or Front of Store Attendant/Cart Attendant) (T1286),Guest Advocate
"On-Demand: Guest Advocate (Cashier), General Merchandise, Fulfillment, Food and Beverage, Style (T2584)",Guest Advocate
"Risk, Operational Risk - Assessments, Vice President - SLC",President
Sr. Loss Prevention Manager,Loss Prevention Manager
Nurse Practitioner Sub-Investigator,Nurse Practitioner (NP)
REFUGEE SERVICES CASE MANAGER,Case Services Manager
Medical Assistant III - Pasadena Main Clinic - Full Time 8 Hour Days (Non-Exempt) (Non-Union),Clinic Assistant
Medical Sonographer Part-time,Medical Sonographer
Housekeeping Aide-EVS Technician,Aide
Registered Nurse Support Team at Mary Greeley Medical Center,Medical RN (Medical Registered Nurse)
"On-Demand: Guest Advocate (Cashier), General Merchandise, Fulfillment, Food and Beverage, Style (T1955)",Guest Advocate
"Client Account Manager, Mid-Market",Market Manager
Lunch Program Supervisor (#130-OA),Supervisor
Guest Advocate (Cashier or Front of Store Attendant/Cart Attendant) (T1350),Guest Advocate
"Account Manager, Business Services",Services Manager
IFRS Technical Accounting Manager,Technical Manager
HVAC Customer Service Consultant,Customer Service Consultant
Board Certified Chaplain - Tampa,Chaplain
Senior Traffic Engineer/ Project Manager,Traffic Manager
"Manager, Global Clinical Supply Chain Planning",Global Supply Chain Manager
Radiologic Technologist ( X - Ray Tech ),Technologist
"Staff Tax Accountant, Indirect Tax",Accountant
Commercial Lines Customer Service Representative,Commercial Representative
"Senior Mechanical Engineer Facilities- Bethlehem, PA",Mechanical Engineer
Guest Advocate (Cashier or Front of Store Attendant/Cart Attendant) (T1141),Guest Advocate
CT Technologist (Cat Scan Tech),Technologist
Guest Advisor (Store 5816),Advisor
"Travel Registered Nurse - Med/Surg - $2,262 / week",Travel RN (Travel Registered Nurse)
Account Executive - Online Division - Grand Canyon University - Remote,Account Executive
RISE RESTAURANT - HOST/CASHIER - PT,Restaurant Host
HomeGoods Department Supervisor Full Time - HomeGoods,Supervisor
Guest Advocate (Cashier or Front of Store Attendant/Cart Attendant) (T2226),Guest Advocate
"Optometric Technician - Medical Assistant - No weekends or evenings, full benefits!",Optometric Technician
Nursing Assistant Spinal Cord Injury,Nursing Assistant
Guest Advocate (Cashier or Front of Store Attendant/Cart Attendant) (T2822),Guest Advocate
Clinical Practice Manager- ESCO-Oncology,Practice Manager
"Assistant Nurse Manager, Med Surg/Tele at Kaiser Permanente",Nurse Manager
Janitorial Supervisor - Westlake Center,Supervisor
Multimedia Account Executive,Account Executive
RN Manager Acute Care Telemetry at HCA Healthcare,Healthcare Manager
"Customer Service Representative- Covington, KY",Customer Service Representative
Primary Care Nurse Practitioner- New Philadelphia,PCNP (Primary Care Nurse Practitioner)
Mako Associate Account Executive - South Texas,Account Executive
Training Supervisor (Maintenance),Training Supervisor
Patient Care Technician - Tele/Oncology - P/T With Benefits Nights,Benefits Technician
Guest Advocate (Cashier or Front of Store Attendant/Cart Attendant) (T1544),Guest Advocate
Revenue Auditor I,Auditor
Patient Care Technician - SRI - IP Nursing - F/T Days,Nursing Technician
Service Manager - Community Beds,Social and Community Service Managers - Case Manager
Contract Recruitment Vice President,President
Surgical Technologist - Cert - ASC First Assist- Full Time,Technologist
"Lead Compliance Officer, RCM Compliance Reg. Inventory Oversight",Tax Compliance Officer
Customer Service Representative - Utility (Hybrid),Customer Service Representative
Warehouse Performance Supervisor,Supervisor
"On-Demand: Guest Advocate (Cashier), General Merchandise, Fulfillment, Food and Beverage, Style (T2166)",Guest Advocate
"Sr Engineer, New Product Integration",Integration Engineer
"On-Demand: Guest Advocate (Cashier), General Merchandise, Fulfillment, Food and Beverage, Style (T2070)",Guest Advocate
Supervisor HIM Operations - St. Peter's Hospital –Full Time Days,Hospital Supervisor
Central Office Supervisor (Telecom),Supervisor
Senior Account Executive - ITOM - Security - Cloud,Account Executive
Field Support Supervisor,Supervisor
Account Executive Corporate (Aspire),Corporate Executive
Facilities Supervisor - Band 3,Supervisor
Assistant General Manager - East Harrisburg - 4710,General Manager (GM)
Health Unit Coordinator CDH Emergency Department Full-time Days,Health Unit Coordinator
Marketing Consultant-TV,Market Research Analysts and Marketing Specialists - Marketing Consultant
CAD Design Supervisor,Supervisor
Cargo Handler - Part Time,Cargo Handler
Guest Advocate (Cashier or Front of Store Attendant/Cart Attendant) (T1375),Guest Advocate
Account Executive- Political,Account Executive
Athletic Trainer-Orthopaedics,Athletic Trainer
Intake Licensed Mental Health Therapist-Independent - EB,Licensed Therapist
On Site Manager,On-Site Manager
SENIOR ACCOUNTANT | MID TIER FIRM | $100K PKG,Accountant
"On-Demand: Guest Advocate (Cashier), General Merchandise, Fulfillment, Food and Beverage, Style (T0167)",Guest Advocate
Imaging Service Engineer I,Imaging Service Engineer
Senior Accountant/CPA,Accountant
"Guest Advocate (Cashier), General Merchandise, Inbound (Stocking), Starbucks (T3244)",Guest Advocate
Nurse Practitioner/Physician Assistant- Urgent Care Float Pool- PRN- Boise,Urgent Care Physician
Physician- Family Medicine- South,Family Medicine Physician
Personal Trainer and Fitness Area Supervisor - Part Time,Supervisor
"Child/Adolescent Psychiatrist Opportunity ~ Green Bay, Wisconsin",Child Psychiatrist
"Senior Accountant - Plano, TX (80k-90k)",Accountant
Assistant or Associate Professor - Medical Imaging & AI,C++ Professor
Catering manager dover de,Catering Manager
"Part Time Assistant Manager -Northeast Mall, Hurst, TX",Mall Manager
Snr Control Software Engineer,Software Engineer
"Account Executive, Commercial Lines - Business Insurance - Livonia, MI (MMA Upper Midwest)",Business Executive
Radiology Technologist (X-ray/CT) - PRN Days,Technologist
"Parts Advisor in Oxford, UK",Advisor
"Internal Medicine Physician - $275,000/yearly - $355,000/yearly",Internal Medicine Physician
Supervisor - 3PL Operations,Supervisor
"On-Demand: Guest Advocate (Cashier), General Merchandise, Fulfillment, Food and Beverage, Style (T1536)",Guest Advocate
Volunteer: Moments Hospice Support Group Facilitator - North Chicago,Facilitator
Product Safety and Compliance Engineer,Product Safety Engineer
Guest Advocate (Cashier or Front of Store Attendant/Cart Attendant) (T2388),Guest Advocate
Electrical Engineer Intern,Electrical Engineer
Early Childhood Education Assistant Instructor (Full-Time),Education Instructor
Food Service Specialist Substitute - IDEA Rio Vista (Immediate Opening),Substitute
Medication Prior Authorization Coordinator II,Prior
"Health, Safety and Environment Manager",Health Manager
"On-Demand: Guest Advocate (Cashier), General Merchandise, Fulfillment, Food and Beverage, Style (T2053)",Guest Advocate
Financial Management Analyst (Logistics),Logistics Analyst
GEICO Customer Service Representative,Customer Service Representative
Customer Success Manager - SaaS,Customer Manager
Guest Advocate (Cashier or Front of Store Attendant/Cart Attendant) (T0995),Guest Advocate
"On-Demand: Guest Advocate (Cashier), General Merchandise, Fulfillment, Food and Beverage, Style (T1241)",Guest Advocate
Make Ready Tech / Assistant Maintenance,Maintenance Assistant
"Assistant Supervisor, Park Operations (Part-Time)",Supervisor
Guest Advocate (Cashier or Front of Store Attendant/Cart Attendant) (T1464),Guest Advocate
Radiology Technologist II - Beavercreek - Radiology - FT/Days,Technologist
Guest Advocate (Cashier or Front of Store Attendant/ Cart Attendant) (T2902),Guest Advocate
Service Advisor - Zimbrick Honda,Advisor
Sr Java developer,Java Developer
Guest Advocate (Cashier or Front of Store Attendant/Cart Attendant) (T1106),Guest Advocate
JUVENILE HALL COUNSELOR I/II,Juvenile Counselor
Syva Product and Marketing Manager (Hybrid),Marketing Product Manager
Auditor Interno,Auditor
Customer Service Representative PDX Airport Full-time,Customer Service Representative
Assistant Community Manager - Heron at River Island,River
Guest Advocate (Cashier or Front of Store Attendant/Cart Attendant) (T2246),Guest Advocate
MEDICAL ASSISTANT,Biological Technicians - Medical Lab Assistant
"Studio Coach - Highlands Ranch, CO",Coach
Guest Advocate (Cashier or Front of Store Attendant/Cart Attendant) (T3376),Guest Advocate
Overnight Veterinary Receptionist,Receptionist
Physician-Hospitalist Part time,Hospitalist
SUPERVISOR IT SERVICE DESK,Supervisor
"On-Demand: Guest Advocate (Cashier), General Merchandise, Fulfillment, Food and Beverage, Style (T2542)",Guest Advocate
Quality Cage Inspector | Manufacturing Engineer,Manufacturing Engineer
Senior Accountant-Hybrid Office Envrionment,Accountant
Software Developer IV,Software Developer
Registered Nurse - Emergency Department - Night Shift at Munson Healthcare,Emergency Department RN (Emergency Department Registered Nurse)
Site Superintendent-Calgary,Site Superintendent
TB MS Assistant General Manager,General Manager (GM)
Cost manager,Cost Accounting Manager
GP Outreach Worker,Community Health Outreach Worker
Strategic Accounts Customer Success Manager,Customer Manager
Guest Advocate (Cashier or Front of Store Attendant/Cart Attendant) (T0848),Guest Advocate
Night Audit,Night Auditor
Plumber / Lead Plumbing Technician,Plumber
Purchasing Account Manager,Purchasing Manager
Nuclear Fuel Engineer,Nuclear Engineer
"Account Manager – Business Development (Knoxville, TN)",Web Development Manager
Enterprise Account Executive - Ohio/Michigan,Account Executive
"On-Demand: Guest Advocate (Cashier), General Merchandise, Fulfillment, Food and Beverage, Style (T2218)",Guest Advocate
TCA Supervisor - Key Account Team,Supervisor
"Assistant Vice President, Mortgage Sales Manager",President
(Partial Remote) - Fire Protection Engineer,Protection Engineer
"IT Technical Manager, Enterprise Cloud Services",Enterprise Services Manager
Head Coach: Field Hockey,Coach
Brand and Marketing Manager,Marketing Managers - Brand Manager
Aircraft Appearance Supervisor,Supervisor
Global Account Manager- US Federal Government,Global Account Manager (GAM)
"Ambulatory Services Nurse II, Operating Room at Sutter Health",OR Nurse (Operating Room Nurse)
Account Manager Retail SMB,Retail Manager
"Sr. Account Executive, Professional Services",Account Executive
Registered Nurse (PDN) - School Setting at Maxim Healthcare Services,School Nurse
Senior Accountant - Scottsbluff,Accountant
PRN - Physical Therapist Assistant,Physical Therapist Assistant (PTA)
Research And Development Specialist,Development Specialist
Assistant General Manager-wrentham-4503,General Manager (GM)
Technical Team Leader,Team Leader
2024-25 Middle School Dean of Students,Dean of Students
"On-Demand: Guest Advocate (Cashier), General Merchandise, Fulfillment, Food and Beverage, Style (T1280)",Guest Advocate
"Field Service Engineer, AV",Aerospace Engineers - Field Service Engineer
Senior Paralegal/NQ - 3 month contract,Paralegal
"Supervisor, Cargo Management, Export Documentation",Supervisor
"Account Executive, Screening, Baltimore (Baltimore, Towson, Glen Burnie, South Gate, Catonsville, Randallstown)",Account Executive
Business Immigration - Senior Associate Attorney,Attorney
Hospitalist/Nocturnist,Hospitalist
"Staff Mechanical Engineer, Space Products",Space Engineer
"Project Manager, IT, PMP-locals-Portland, OR",Project Manager (PM)
Per Diem Radiology Technologist (Rad/Xray Tech),Technologist
Invasive Cardiologist Needed in The Villages/Lady Lake FL Practice,Invasive Cardiologist
Assistant Professor MCG-Med-Cardiology-Part Time,C++ Professor
Airport Customer Service Agent - KTN,Customer Agent
Hydraulic Modelling Specialist,Hydraulic Specialist
Associate Director PFS Education & Quality,Quality Director
Supply Chain Industrial Engineer,Industrial Engineer
Radiologic Technologist-X-Ray Tech Part-Time,Technologist
"Executive Chef - Loveland, CO",Executive Chef (Ex Chef)
Medical Assistant / Plastic Surgery,Surgery Assistant
Pediatric Emergency Department Physician,Emergency Physician
Industrial Recruitment Consultant,Recruitment Consultant
Concessions Admin Assistant - Lumen Field,Field Assistant
"Guest Advocate (Cashier), General Merchandise, Inbound (Stocking) (T3294)",Guest Advocate
Server Supervisor - FT (Sawbucks Pub),Supervisor
"Nurse Practitioner; Home Base Medical - Reading, PA",Nurse Practitioner (NP)
"On-Demand: Guest Advocate (Cashier), General Merchandise, Fulfillment, Food and Beverage, Style (T0910)",Guest Advocate
OPS COMMUNITY HEALTH NURSE - 64858492,Community Health Nurse
Registered Nurse RN Child Psychiatric,Psychiatric Nurse
Guest Advocate (Cashier or Front of Store Attendant/Cart Attendant) (T2601),Guest Advocate
Volunteer: Girl Scout Daisy Troop Leader- Lackawanna County,Scout
"Supervisor, Research Project Management",Supervisor
Process Engineer- Manufacturing Science & Technology,Manufacturing Engineer
Beauty Advisor (Inside Sales) Sally Beauty 01600,Advisor
"Pediatrics Physician - $110,000/yearly - $120,000/yearly",Pediatrics Physician
"On-Demand: Guest Advocate (Cashier), General Merchandise, Fulfillment, Food and Beverage, Style (T1912)",Guest Advocate
Material Flow Coordinator,Material Coordinator
Regional Account Manager (Pacific Northwest),Regional Manager
"Account Executive, National Accounts",Account Executive
"Sr. Calibration Engineer, Cell Manufacturing",Manufacturing Engineer
Roving Specialist Trainer & Assessor,Assessor
Account Executive: Private Companies,Account Executive
"Care Manager, RN",Career Manager
Guest Advocate (Cashier or Front of Store Attendant/Cart Attendant) (T2270),Guest Advocate
Guest Advisor (Store 3973),Advisor
"Sr. Engineer, Mechanical (Static) (Ref ID: 632)",Mechanical Engineer
Beauty Advisor (Inside Sales) Sally Beauty 03674,Advisor
Engineer Supervisor - Supplier Quality,Supervisor
Outside Sales Representative/Account Manager,Sales Account Manager
Manufacturing Engineer / Sr Manufacturing Engineer,Manufacturing Engineer
Guest Advocate (Cashier or Front of Store Attendant/Cart Attendant) (T0300),Guest Advocate
"On-Demand: Guest Advocate (Cashier), General Merchandise, Fulfillment, Food and Beverage, Style (T2211)",Guest Advocate
Internal Auditor Senior,Auditor
City Manager (EM),City Manager
Operation Hero Program Facilitator,Facilitator
COACH Tanger Outlets - Sales Associate III,Coach
Guest Advocate (Cashier or Front of Store Attendant/Cart Attendant) (T2764),Guest Advocate
Decatur and Charleston Retail Key Holder (Part-Time),Key Holder
eBusiness Specialist - S2S Catalog Operations,Web Operations Specialist
"On-Demand: Guest Advocate (Cashier), General Merchandise, Fulfillment, Food and Beverage, Style (T2181)",Guest Advocate
"Speech Language Pathologist - North Fort Worth, Keller, Southlake TX",Language Pathologist
Guest Advocate (Cashier or Front of Store Attendant/Cart Attendant) (T1413),Guest Advocate
"On-Demand: Guest Advocate (Cashier), General Merchandise, Fulfillment (T3407)",Guest Advocate
Senior Battery Process Engineer - Cell Manufacturing,Manufacturing Engineer
"Sr. Principal Engineer - Air Breathing Propulsion in Phoenix, AZ, USA",Propulsion Engineer
Allied Health Team Leader - Central Coast,Team Leader
BEHAVIORAL HEALTH CONSULTANT (FFPSA) OPS - 60933445,Behavioral Health Consultant
Mechanical / Electrical Project Engineer,Electrical Engineer
HEAD PIZZA CHEF,Head Chef
Engineering Technician - Off shift,Engineering Test Technician
Account Executive US | Enterprise,Account Executive
NEW HOTEL OPENING - Reservations Manager,Hotel Manager
Accountant/Bookkeeper II,Accountant
Electronics Process Engineer,Electronics Engineer
Bar Host Person-Beverage 1,Bar Host
"Veterinary Receptionist - Renton, WA",Receptionist
Human Resources Administration Specialist - Operations,Human Resources Specialist (HR Specialist)
Crisis Mental Health Nurse,Mental Health Nurse
"Manager, Hospital Services",Hospital Manager
Project Engineer - Water/Wastewater,Water/Wastewater Engineers - Remediation Project Engineer
Nurse Tech Cardiac Progressive Care 6Heart,Progressive Care Nurse
"Lead QA/QC Auditor, Pharmaceutical Compliance",Auditor
Medical Assistant-General Surgery (Physician Practice),Surgery Assistant
Data Operations 1,Data Operations Director
Licensed Insurance Sales Broker - Quebec,Insurance Broker
Hair Stylist - Waterford Village,Hair Stylist
Assistant General Manager - Waterville 7114,General Manager (GM)
Registered Nurse – Emergency Room - Travel - (ER RN) - 24177923EXPPLAT /,Emergency Room Nurse (ER Nurse)
Guest Advocate (Cashier or Front of Store Attendant/Cart Attendant) (T1896),Guest Advocate
Express Service Advisor/Writer,Advisor
Guest Advocate (Cashier or Front of Store Attendant/Cart Attendant) (T2787),Guest Advocate
Guest Advisor (Store 5249),Advisor
Tools Sales & Support Representative - UHR,Unit Support Representative
Service Technician - Low Voltage Security - Sign on Bonus,Low Voltage Technician
"On-Demand: Guest Advocate (Cashier), General Merchandise, Fulfillment, Food and Beverage, Style (T1797)",Guest Advocate
Senior MEP Manager - Real Estate Developer,Real Estate Manager
Medical Education Simulation Technologist - 008625,Technologist
"Assistant Project Manager, WHI Study, Epidemiology",Project Assistant
"On-Demand: Guest Advocate (Cashier), General Merchandise, Fulfillment (T3302)",Guest Advocate
Staff Physician-Commun Med-PRN,Staff Physician
Maintenance Assistant,"Helpers--Installation, Maintenance, and Repair Workers - Electrical Assistant"
"Health & Safety Manager, Bluetownonline",Health Manager
"On-Demand: Guest Advocate (Cashier), General Merchandise, Fulfillment, Food and Beverage, Style (T2046)",Guest Advocate
"Private Dentist - Ripon, North Yorkshire (Two days per week, private role in a mixed practice, superb earning potential, high demand for private, skills in invisalign & teeth whitening desirable)",Dentist
Associate Project Manager/Project Manager,Project Manager (PM)
"Accountant (Hybrid) - Canton, MI",Accountant
Medical Assistant - Lab,Biological Technicians - Medical Lab Assistant
Guest Advocate (Cashier or Front of Store Attendant/Cart Attendant) (T1949),Guest Advocate
"Audit Senior Associate, Federal Audit (TS/SCI required)",Audit Associate
"Program Director, Public Programs",Director
Customer Service Representative-CBO Support Services-FT Days  BHC,Customer Support Representative
Principal Clinical Psychologist (Older Adults Community),Clinical Psychologist
"On-Demand: Guest Advocate (Cashier), General Merchandise, Fulfillment, Food and Beverage, Style (T2840)",Guest Advocate
Medical Assistant III - CV Surgery,Surgery Assistant
Medical Scribe/Medical Assistant - No weekends! Full benefits!,Scribe
Santa Photo Set Manager - The Mall at Prince Georges(3),Mall Manager
